{
  "$schema": "http://json-schema.org/draft-07/schema#",
  "$id": "https://westerosblocks.com/schemas/block-set-definition.json",
  "title": "WesterosBlocks Block Set Definition",
  "description": "Defines a block set that expands into multiple variant blocks (solid, stairs, slab, wall, etc.)",
  "type": "object",
  "required": ["baseBlockName", "baseLabel"],
  "properties": {
    "baseBlockName": {
      "type": "string",
      "description": "Base name used to generate variant names (e.g., 'arbor_brick' -> 'arbor_brick_stairs')"
    },
    "baseLabel": {
      "type": "string",
      "description": "Base label for all variants (e.g., 'Medium Ashlar Arbor' -> 'Medium Ashlar Arbor Stairs')"
    },
    "variants": {
      "type": "array",
      "description": "List of variants to create. Defaults to ['solid', 'stairs', 'slab', 'wall', 'fence', 'hopper']",
      "items": {
        "type": "string",
        "enum": [
          "solid", "stairs", "slab", "wall", "fence", "hopper", "tip",
          "carpet", "fence_gate", "half_door", "cover", "hollow_hopper",
          "log", "directional", "layer", "pane", "sand", "path",
          "window_frame", "window_frame_mullion",
          "arrow_slit", "arrow_slit_window", "arrow_slit_ornate",
          "bench"
        ]
      },
      "default": ["solid", "stairs", "slab", "wall", "fence", "hopper"]
    },
    "altNames": {
      "type": "object",
      "description": "Alternative names for specific variants (e.g., {'solid': 'birch_planks'})",
      "additionalProperties": { "type": "string" }
    },
    "altLabels": {
      "type": "object",
      "description": "Alternative labels for specific variants",
      "additionalProperties": { "type": "string" }
    },
    "options": {
      "type": "object",
      "description": "Options attributes for specific variants. Supports legacy string format (e.g., 'locked:true') or structured object format (e.g., {'locked': true})",
      "additionalProperties": {
        "oneOf": [
          { "type": "string" },
          { "$ref": "#/$defs/OptionsProperties" }
        ]
      }
    },
    "altCustomTags": {
      "type": "object",
      "description": "Custom tags for specific variants (e.g., {'solid': ['wood_ctm']})",
      "additionalProperties": {
        "type": "array",
        "items": { "type": "string" }
      }
    },
    "altTextures": {
      "type": "object",
      "description": "Alternative textures for specific variants",
      "additionalProperties": {
        "type": "array",
        "items": { "type": "string" }
      }
    },
    "altRandomTextures": {
      "type": "object",
      "description": "Per-variant random texture sets (e.g. {'slab': [{'textures': ['all','directional1','all']}, ...]}). The variant picks randomly among the entries; used for CTM blocks like slate.",
      "additionalProperties": {
        "type": "array",
        "items": { "$ref": "#/$defs/AltRandomTextureEntry" }
      }
    },
    "textures": {
      "type": "object",
      "description": "Texture map for variants. Keys: 'all', 'sides', 'bottom', 'top', 'north', 'south', 'east', 'west', 'arrow-slit', 'window-frame', 'cover', etc.",
      "properties": {
        "all": {
          "type": "string",
          "description": "Single texture for all faces (expanded to bottom/top/sides)"
        },
        "sides": {
          "type": "string",
          "description": "Texture for side faces"
        },
        "bottom": {
          "type": "string",
          "description": "Texture for bottom face"
        },
        "top": {
          "type": "string",
          "description": "Texture for top face"
        },
        "north": {
          "type": "string",
          "description": "Texture for north face"
        },
        "south": {
          "type": "string",
          "description": "Texture for south face"
        },
        "east": {
          "type": "string",
          "description": "Texture for east face"
        },
        "west": {
          "type": "string",
          "description": "Texture for west face"
        },
        "cover": {
          "type": "string",
          "description": "Texture for cover/rail variants"
        },
        "arrow-slit": {
          "type": "string",
          "description": "Texture for arrow slit variants"
        },
        "arrow-slit-window": {
          "type": "string",
          "description": "Texture for arrow slit window variants"
        },
        "arrow-slit-ornate": {
          "type": "string",
          "description": "Texture for ornate arrow slit variants"
        },
        "window-frame": {
          "type": "string",
          "description": "Texture for window frame variants"
        },
        "window-frame-mullion": {
          "type": "string",
          "description": "Texture for window frame mullion variants"
        },
        "window-topbottom": {
          "type": "string",
          "description": "Texture for window top/bottom"
        }
      },
      "additionalProperties": { "type": "string" }
    },
    "overlayTextures": {
      "type": "object",
      "description": "Overlay texture map for tinted blocks",
      "additionalProperties": { "type": "string" }
    },
    "randomTextures": {
      "type": "array",
      "description": "Random texture variants for all variants in this set",
      "items": {
        "$ref": "#/$defs/RandomTextureEntry"
      }
    },
    "states": {
      "type": "array",
      "description": "State records for blocks with multiple states",
      "items": {
        "$ref": "#/$defs/StateRecord"
      }
    },
    "hardness": {
      "type": "number",
      "description": "Block hardness (mining time)"
    },
    "soundGroup": {
      "type": "string",
      "description": "Sound effect when walking/placing/breaking",
      "enum": [
        "stone", "wood", "gravel", "grass", "metal", "glass",
        "wool", "cloth", "sand", "snow", "ladder", "anvil",
        "plant", "slime", "bamboo", "lantern", "nether_bricks",
        "netherite", "powder"
      ]
    },
    "material": {
      "type": "string",
      "description": "Generic material type"
    },
    "resistance": {
      "type": "number",
      "description": "Explosion resistance"
    },
    "lightOpacity": {
      "type": "integer",
      "minimum": 0,
      "maximum": 15,
      "description": "Light opacity (0-15)"
    },
    "harvestLevel": {
      "type": "array",
      "description": "Harvest level requirements",
      "items": {
        "$ref": "#/$defs/HarvestLevel"
      }
    },
    "fireSpreadSpeed": {
      "type": "integer",
      "description": "Fire spread speed"
    },
    "flamability": {
      "type": "integer",
      "description": "Flammability value"
    },
    "creativeTab": {
      "type": "string",
      "description": "Creative tab for all variants"
    },
    "customTags": {
      "type": "array",
      "items": { "type": "string" },
      "description": "Custom tags applied to all variants"
    },
    "alphaRender": {
      "type": "boolean",
      "description": "Alpha rendering for transparency"
    },
    "ambientOcclusion": {
      "type": "boolean",
      "description": "Enable ambient occlusion"
    },
    "nonOpaque": {
      "type": "boolean",
      "description": "Non-opaque block (transparent)"
    },
    "renderLayer": {
      "type": "string",
      "enum": ["cutout", "cutout_mipped", "translucent"],
      "description": "Render layer for transparency"
    },
    "lightValue": {
      "type": "number",
      "description": "Light emission level (0-15)"
    },
    "colorMult": {
      "type": "string",
      "pattern": "^#[0-9A-Fa-f]{6}$",
      "description": "Color multiplier (hex)"
    },
    "mapColor": {
      "type": "string",
      "description": "MapColor used by paper maps and minimap mods (Xaero, Dynmap). Name of a constant on net.minecraft.block.MapColor (case-insensitive). If omitted, derived from soundGroup.",
      "enum": [
        "CLEAR",
        "PALE_GREEN",
        "PALE_YELLOW",
        "WHITE_GRAY",
        "BRIGHT_RED",
        "PALE_PURPLE",
        "IRON_GRAY",
        "DARK_GREEN",
        "WHITE",
        "LIGHT_BLUE_GRAY",
        "DIRT_BROWN",
        "STONE_GRAY",
        "WATER_BLUE",
        "OAK_TAN",
        "OFF_WHITE",
        "ORANGE",
        "MAGENTA",
        "LIGHT_BLUE",
        "YELLOW",
        "LIME",
        "PINK",
        "GRAY",
        "LIGHT_GRAY",
        "CYAN",
        "PURPLE",
        "BLUE",
        "BROWN",
        "GREEN",
        "RED",
        "BLACK",
        "GOLD",
        "DIAMOND_BLUE",
        "LAPIS_BLUE",
        "EMERALD_GREEN",
        "SPRUCE_BROWN",
        "DARK_RED",
        "TERRACOTTA_WHITE",
        "TERRACOTTA_ORANGE",
        "TERRACOTTA_MAGENTA",
        "TERRACOTTA_LIGHT_BLUE",
        "TERRACOTTA_YELLOW",
        "TERRACOTTA_LIME",
        "TERRACOTTA_PINK",
        "TERRACOTTA_GRAY",
        "TERRACOTTA_LIGHT_GRAY",
        "TERRACOTTA_CYAN",
        "TERRACOTTA_PURPLE",
        "TERRACOTTA_BLUE",
        "TERRACOTTA_BROWN",
        "TERRACOTTA_GREEN",
        "TERRACOTTA_RED",
        "TERRACOTTA_BLACK",
        "DULL_RED",
        "DULL_PINK",
        "DARK_CRIMSON",
        "TEAL",
        "DARK_AQUA",
        "DARK_DULL_PINK",
        "BRIGHT_TEAL",
        "DEEPSLATE_GRAY",
        "RAW_IRON_PINK",
        "LICHEN_GREEN"
      ]
    }
  },
  "$defs": {
    "RandomTextureEntry": {
      "type": "object",
      "description": "Random texture entry for block sets",
      "properties": {
        "textures": {
          "type": "object",
          "description": "Texture map that will be expanded based on variant requirements",
          "additionalProperties": { "type": "string" }
        },
        "weight": {
          "type": "integer",
          "minimum": 1,
          "default": 1,
          "description": "Selection weight"
        }
      },
      "required": ["textures"]
    },
    "AltRandomTextureEntry": {
      "type": "object",
      "description": "Per-variant random texture entry. Textures are a positional list (same convention as altTextures), not a keyed map.",
      "properties": {
        "textures": {
          "type": "array",
          "description": "Positional texture list for the variant",
          "items": { "type": "string" }
        },
        "weight": {
          "type": "integer",
          "minimum": 1,
          "default": 1,
          "description": "Selection weight"
        }
      },
      "required": ["textures"]
    },
    "StateRecord": {
      "type": "object",
      "description": "State record for multi-state block sets",
      "properties": {
        "stateID": {
          "type": "string",
          "description": "Unique state identifier"
        },
        "excludeVariants": {
          "type": "string",
          "description": "Comma-separated variants to exclude from this state"
        },
        "lightValue": {
          "type": "number",
          "description": "Light value for this state"
        },
        "colorMult": {
          "type": "string",
          "pattern": "^#[0-9A-Fa-f]{6}$",
          "description": "Color multiplier for this state"
        },
        "altTextures": {
          "type": "object",
          "description": "Alternative textures per variant for this state",
          "additionalProperties": {
            "type": "array",
            "items": { "type": "string" }
          }
        },
        "altRandomTextures": {
          "type": "object",
          "description": "Per-variant random texture sets for this state",
          "additionalProperties": {
            "type": "array",
            "items": { "$ref": "#/$defs/AltRandomTextureEntry" }
          }
        },
        "textures": {
          "type": "object",
          "description": "Texture map for this state",
          "additionalProperties": { "type": "string" }
        },
        "overlayTextures": {
          "type": "object",
          "description": "Overlay textures for this state",
          "additionalProperties": { "type": "string" }
        }
      },
      "required": ["stateID"]
    },
    "HarvestLevel": {
      "type": "object",
      "description": "Tool requirement for harvesting",
      "properties": {
        "tool": {
          "type": "string",
          "enum": ["pickaxe", "axe", "shovel", "hoe", "sword", "shears"],
          "description": "Tool type required"
        },
        "level": {
          "type": "integer",
          "minimum": 0,
          "maximum": 4,
          "description": "Tool tier (0=wood, 1=stone, 2=iron, 3=diamond, 4=netherite)"
        }
      },
      "required": ["tool", "level"]
    },
    "OptionsProperties": {
      "type": "object",
      "description": "Structured options properties for block-specific behavior",
      "properties": {
        "unconnect": {
          "type": "boolean",
          "description": "Stair/Wall/Fence/Pane: disable automatic connection to adjacent blocks"
        },
        "connectstate": {
          "type": "boolean",
          "description": "Enable connect state cycling feature"
        },
        "noUvlock": {
          "type": "boolean",
          "description": "Disable UV lock on block models"
        },
        "barsModel": {
          "type": "boolean",
          "description": "Pane: use bars model instead of pane model"
        },
        "legacyModel": {
          "type": "boolean",
          "description": "Pane: use legacy model format"
        },
        "noDecay": {
          "type": "boolean",
          "description": "Leaves: prevent natural decay"
        },
        "betterFoliage": {
          "type": "boolean",
          "description": "Leaves: enable Better Foliage rendering"
        },
        "overlay": {
          "type": "boolean",
          "description": "Leaves: use overlay textures"
        },
        "allowUnsupported": {
          "type": "boolean",
          "description": "Torch/Ladder/Door: allow placement without support block"
        },
        "noParticle": {
          "type": "boolean",
          "description": "Torch: disable flame particles"
        },
        "locked": {
          "type": "boolean",
          "description": "Door/Gate: lock in closed position"
        },
        "alwaysOn": {
          "type": "boolean",
          "description": "Furnace: always show lit state"
        },
        "plantId": {
          "type": "string",
          "description": "Flowerpot: ID of the plant to display"
        },
        "noInWeb": {
          "type": "boolean",
          "description": "Web: don't slow entities"
        },
        "noClimb": {
          "type": "boolean",
          "description": "Vines: disable climbing"
        },
        "toggleOnUse": {
          "type": "boolean",
          "description": "Enable state cycling on right-click (creative mode)"
        },
        "layerSensitive": {
          "type": "boolean",
          "description": "Allow placement on layer blocks"
        },
        "symmetrical": {
          "type": "boolean",
          "description": "Use symmetrical texture mapping"
        },
        "noBreakUnder": {
          "type": "boolean",
          "description": "Stack blocks: prevent breaking blocks underneath"
        },
        "allowHalfBreak": {
          "type": "boolean",
          "description": "Stack blocks: allow breaking top half independently"
        },
        "hasClimb": {
          "type": "boolean",
          "description": "Vines: enable climbing like ladders"
        },
        "hasDown": {
          "type": "boolean",
          "description": "Vines: can grow/extend downward"
        },
        "wallSize": {
          "type": "string",
          "enum": ["normal", "short"],
          "description": "Wall height: 'normal' (16 blocks) or 'short' (13 blocks)"
        },
        "wallModel": {
          "type": "string",
          "enum": ["normal", "hedge"],
          "description": "Model variant: 'normal' (solid wall) or 'hedge' (leafy crossing-plane geometry)"
        },
        "bedType": {
          "type": "string",
          "description": "Bed variant type identifier"
        },
        "rotateRandom": {
          "type": "boolean",
          "description": "Randomly rotate block model on placement (Y-axis)"
        }
      },
      "additionalProperties": false
    }
  }
}
