{
    "baseBlockName": "small_smooth_stone_brick",
    "variants": [
        "solid",
        "stairs",
        "slab",
        "wall",
        "fence",
        "hopper",
        "tip",
        "arrow_slit",
        "arrow_slit_window",
        "arrow_slit_ornate"
    ],
    "hardness": 1.5,
    "soundGroup": "stone",
    "mapColor": "DEEPSLATE_GRAY",
    "resistance": 10,
    "harvestLevel": [
        {
            "tool": "pickaxe",
            "level": 1
        }
    ],
    "creativeTab": "westeros_quarter_ashlar_tab",
    "baseLabel": "Quarter Rounded Ashlar Normal Grey",
    "colorMult": "textures/colormap/small_smooth_stone_brick",
    "textures": {
        "all": "ashlar_quarter_rounded/grey/all",
        "arrow-slit": "ashlar_quarter_rounded/grey/arrow_slit",
        "arrow-slit-window": "ashlar_quarter_rounded/grey/arrow_slit_window",
        "arrow-slit-ornate": "ashlar_quarter_rounded/grey/arrow_slit_ornate"
    }
}
