{
    "baseBlockName": "black_granite_polished",
    "variants": [
        "solid",
        "stairs",
        "slab",
        "wall"
    ],
    "hardness": 1.5,
    "soundGroup": "stone",
    "material": "rock",
    "resistance": 10,
    "harvestLevel": [
        {
            "tool": "pickaxe",
            "level": 1
        }
    ],
    "creativeTab": "westeros_polished_stone_tab",
    "customTags": [
        "polished-stone-ctm"
    ],
    "options": {
        "solid,slab": "connectstate:true",
        "stairs,wall": "unconnect:false,connectstate:true"
    },
    "baseLabel": "Polished Stone Black",
    "textures": {
        "all": "ashlar_full/black/all"
    }
}